{
  "$id": "",
  "$schema": "https://json-schema.org/draft/2020-12/schema",
  "title": "JSON Schema para os JSONs de definição de cada elemento de diagrama",
  "type": [
    "object"
  ],
  "properties": {
    "classesElemento": {
      "description": "Define quais classes este tipo de elemento deve ter.",
      "type": ["array"],
      "items": {
        "type": "string"
      }
    },
    "recebePontoExtensor": {
      "type": "boolean"
    },
    "recebeSetaConectora": {
      "type": "boolean"
    },
    "valorHtmlInterno": {
      "description": "Define a estrutura interna do HTML deste tipo de elemento",
      "type": ["string"]
    },
    "propriedades": {
      "description": "Define as propriedades deste tipo de elemento que podem ser editadas",
      "type": "array",
      "items": {
        "type": "object",
        "properties": {
          "chaveI18nLabel": {
            "type": "string"
          },
          "chaveI18nValorInicial": {
            "type": "string"
          },
          "classeElemento": {
            "type": "string"
          },
          "nomePropriedade": {
            "type": "string"
          },
          "sufixo": {
            "type": "string"
          },
          "chavesI18nLabelsValoresPermitidos": {
            "type": "array",
            "items": { "type": "string" }
          },
          "valoresPermitidos": {
            "type": "array",
            "items": { "type": "string" }
          }
        },
        "required": [
          "chaveI18nLabel",
          "classeElemento",
          "nomePropriedade",
          "sufixo"
        ]
      }
    }
  },
  "required": [
    "classesElemento",
    "valorHtmlInterno",
    "recebePontoExtensor",
    "recebeSetaConectora",
    "propriedades"
  ]
}
