{
  "$schema": ".elemento.schema.json",
  "valorHtmlInterno": "<div></div>",
  "classesElemento": ["elemento-especializacao"],
  "recebePontoExtensor": true,
  "recebeSetaConectora": true,
  "propriedades": [
    {
      "chaveI18nLabel": "element.property.rotation.label",
      "classeElemento": "elemento-especializacao",
      "nomePropriedade": "style.rotate",
      "sufixo": "deg"
    }
  ]
}
