{
  "$schema": ".elemento.schema.json",
  "valorHtmlInterno": "<div class=\"losango-interno\"><div contenteditable=\"true\" spellcheck=\"true\" class=\"nome\">AGREGAÇÃO</div></div>",
  "classesElemento": ["elemento-agregacao"],
  "recebePontoExtensor": true,
  "recebeSetaConectora": true,
  "propriedades": [
    {
      "chaveI18nLabel": "element.property.font-size.label",
      "classeElemento": "nome",
      "nomePropriedade": "style.font-size",
      "sufixo": "pt"
    },
    {
      "chaveI18nLabel": "element.property.height.label",
      "classeElemento": "elemento-agregacao",
      "nomePropriedade": "style.height",
      "sufixo": "px"
    },
    {
      "chaveI18nLabel": "element.property.width.label",
      "classeElemento": "elemento-agregacao",
      "nomePropriedade": "style.width",
      "sufixo": "px"
    },
    {
      "chaveI18nLabel": "element.property.x.label",
      "classeElemento": "elemento-agregacao",
      "nomePropriedade": "style.left",
      "sufixo": "px"
    },
    {
      "chaveI18nLabel": "element.property.y.label",
      "classeElemento": "elemento-agregacao",
      "nomePropriedade": "style.top",
      "sufixo": "px"
    },
    {
      "chaveI18nLabel": "element.property.name.label",
      "chaveI18nValorInicial": "element.property.default-name.aggregation",
      "classeElemento": "nome",
      "nomePropriedade": "innerText",
      "sufixo": ""
    }
  ]
}
