{
  "$schema": ".elemento.schema.json",
  "valorHtmlInterno": "<div><div contenteditable=\"true\" spellcheck=\"true\" class=\"nome\">RELACIONAMENTO</div></div>",
  "classesElemento": ["elemento-relacionamento"],
  "recebePontoExtensor": true,
  "recebeSetaConectora": true,
  "propriedades": [
    {
      "chaveI18nLabel": "element.property.font-size.label",
      "classeElemento": "nome",
      "nomePropriedade": "style.font-size",
      "sufixo": "pt"
    },
    {
      "chaveI18nLabel": "element.property.name.label",
      "chaveI18nValorInicial": "element.property.default-name.relationship",
      "classeElemento": "nome",
      "nomePropriedade": "innerText",
      "sufixo": ""
    },
    {
      "chaveI18nLabel": "element.property.height.label",
      "classeElemento": "elemento-relacionamento",
      "nomePropriedade": "style.height",
      "sufixo": "px"
    },
    {
      "chaveI18nLabel": "element.property.width.label",
      "classeElemento": "elemento-relacionamento",
      "nomePropriedade": "style.width",
      "sufixo": "px"
    },
    {
      "chaveI18nLabel": "element.property.x.label",
      "classeElemento": "elemento-relacionamento",
      "nomePropriedade": "style.left",
      "sufixo": "px"
    },
    {
      "chaveI18nLabel": "element.property.y.label",
      "classeElemento": "elemento-relacionamento",
      "nomePropriedade": "style.top",
      "sufixo": "px"
    }
  ]
}
