{
  "$schema": ".elemento.schema.json",
  "valorHtmlInterno": "<div class='nome-classe'>CLASSE</div><div class='atributos-classe'></div><div class='metodos-classe'></div>",
  "classesElemento": ["elemento-classe"],
  "recebePontoExtensor": true,
  "recebeSetaConectora": true,
  "propriedades": [
    {
      "chaveI18nLabel": "element.property.name.label",
      "chaveI18nValorInicial": "element.propery.default-value.class",
      "classeElemento": "nome",
      "nomePropriedade": "innerText",
      "sufixo": ""
    }
  ]
}
