{
  "$schema": ".elemento.schema.json",
  "valorHtmlInterno": "<div contenteditable=\"true\" spellcheck=\"true\" class=\"nome\">tbEntidade</div><div class=\"atributo\"><span class=\"chave\"><svg class=\"chave-escondida\"></svg></span><span contenteditable=\"true\" spellcheck=\"true\" class=\"texto\">atributo: tipo</span></div><button class=\"remover-atributo\">-</button><button class=\"adicionar-atributo\">+</button>",
  "classesElemento": ["elemento-tabela-relacional"],
  "recebePontoExtensor": true,
  "recebeSetaConectora": true,
  "propriedades": [
    {
      "chaveI18nLabel": "element.property.font-size.label",
      "classeElemento": "nome",
      "nomePropriedade": "style.font-size",
      "sufixo": "pt"
    },
    {
      "chaveI18nLabel": "element.property.name.label",
      "chaveI18nValorInicial": "element.property.default-name.relational-table",
      "classeElemento": "nome",
      "nomePropriedade": "innerText",
      "sufixo": ""
    },
    {
      "chaveI18nLabel": "element.property.height.label",
      "classeElemento": "elemento-tabela-relacional",
      "nomePropriedade": "style.height",
      "sufixo": "px"
    },
    {
      "chaveI18nLabel": "element.property.width.label",
      "classeElemento": "elemento-tabela-relacional",
      "nomePropriedade": "style.width",
      "sufixo": "px"
    },
    {
      "chaveI18nLabel": "element.property.x.label",
      "classeElemento": "elemento-tabela-relacional",
      "nomePropriedade": "style.left",
      "sufixo": "px"
    },
    {
      "chaveI18nLabel": "element.property.y.label",
      "classeElemento": "elemento-tabela-relacional",
      "nomePropriedade": "style.top",
      "sufixo": "px"
    },
    {
      "chaveI18nLabel": "element.property.attribute.key.label",
      "classeElemento": "chave",
      "nomePropriedade": "child.attribute-key",
      "sufixo": "",
      "chavesI18nLabelsValoresPermitidos": [
        "element.property-value.attribute.key.none",
        "element.property-value.attribute.key.primary",
        "element.property-value.attribute.key.foreign"
      ],
      "valoresPermitidos": ["NONE", "PRIMARY", "FOREIGN"]
    },
    {
      "chaveI18nLabel": "element.property.attribute.name.label",
      "chaveI18nValorInicial": "element.property.default-name.attribute-name",
      "classeElemento": "texto",
      "nomePropriedade": "child.innerText",
      "sufixo": ""
    }
  ]
}
