{
  "$schema": ".elemento.schema.json",
  "valorHtmlInterno": "<div class=\"marcador-atributo\" onclick=\"callbackMarcador(event)\"></div><div  onmouseup=\"callbackInverterAtributo(event)\" contenteditable=\"true\" spellcheck=\"true\" class=\"nome\">atributo</div>",
  "classesElemento": ["elemento-atributo"],
  "recebePontoExtensor": false,
  "recebeSetaConectora": true,
  "propriedades": [
    {
      "chaveI18nLabel": "element.property.font-size.label",
      "classeElemento": "nome",
      "nomePropriedade": "style.font-size",
      "sufixo": "pt"
    },
    {
      "chaveI18nLabel": "element.property.x.label",
      "classeElemento": "elemento-atributo",
      "nomePropriedade": "style.left",
      "sufixo": "px"
    },
    {
      "chaveI18nLabel": "element.property.y.label",
      "classeElemento": "elemento-atributo",
      "nomePropriedade": "style.top",
      "sufixo": "px"
    },
    {
      "chaveI18nLabel": "element.property.name.label",
      "chaveI18nValorInicial": "element.property.default-name.attribute",
      "classeElemento": "nome",
      "nomePropriedade": "innerText",
      "sufixo": ""
    },
    {
      "chaveI18nLabel": "element.property.attribute-type.label",
      "classeElemento": "elemento-atributo",
      "nomePropriedade": "attributeType",
      "sufixo": "",
      "chavesI18nLabelsValoresPermitidos": [
        "element.property.attribute-type.normal.label",
        "element.property.attribute-type.derived.label",
        "element.property.attribute-type.primary-key.label"
      ],
      "valoresPermitidos": ["NORMAL", "DERIVADO", "CHAVE_PRIMARIA"]
    }
  ]
}
