{
  "$schema": ".elemento.schema.json",
  "valorHtmlInterno": "<div class=\"texto\" contenteditable=\"true\" spellcheck=\"true\">Texto</div>",
  "classesElemento": [
    "elemento-texto"
  ],
  "recebePontoExtensor": false,
  "recebeSetaConectora": true,
  "propriedades": [
    {
      "chaveI18nLabel": "element.property.font-size.label",
      "classeElemento": "texto",
      "nomePropriedade": "style.font-size",
      "sufixo": "pt"
    },
    {
      "chaveI18nLabel": "element.property.text.label",
      "chaveI18nValorInicial": "element.property.default-name.text",
      "classeElemento": "texto",
      "nomePropriedade": "innerText",
      "sufixo": ""
    },
    {
      "chaveI18nLabel": "element.property.height.label",
      "classeElemento": "elemento-texto",
      "nomePropriedade": "style.height",
      "sufixo": "px"
    },
    {
      "chaveI18nLabel": "element.property.width.label",
      "classeElemento": "elemento-texto",
      "nomePropriedade": "style.width",
      "sufixo": "px"
    },
    {
      "chaveI18nLabel": "element.property.x.label",
      "classeElemento": "elemento-texto",
      "nomePropriedade": "style.left",
      "sufixo": "px"
    },
    {
      "chaveI18nLabel": "element.property.y.label",
      "classeElemento": "elemento-texto",
      "nomePropriedade": "style.top",
      "sufixo": "px"
    }
  ]
}
